{
  "schema_version": "1.0",
  "case_id": "case_03_quadruped_beast",
  "animation": "bite_attack",
  "category": "action",
  "length": 0.65,
  "loop": false,
  "tracks": [
    {
      "target": "bone",
      "name": "neck",
      "property": "rotation_degrees",
      "keys": [
        {
          "time": 0,
          "value": -4
        },
        {
          "time": 0.18,
          "value": -16
        },
        {
          "time": 0.28,
          "value": 14
        },
        {
          "time": 0.65,
          "value": 0
        }
      ]
    },
    {
      "target": "bone",
      "name": "jaw",
      "property": "rotation_degrees",
      "keys": [
        {
          "time": 0,
          "value": 0
        },
        {
          "time": 0.18,
          "value": 22
        },
        {
          "time": 0.28,
          "value": -8
        },
        {
          "time": 0.65,
          "value": 0
        }
      ]
    }
  ],
  "events": [
    {
      "time": 0.24,
      "name": "hitbox_on",
      "target": "bite_hitbox"
    },
    {
      "time": 0.36,
      "name": "hitbox_off",
      "target": "bite_hitbox"
    }
  ]
}
