{
  "schema_version": "1.0",
  "case_id": "case_01_humanoid_adventurer",
  "animation": "run",
  "category": "move",
  "length": 0.8,
  "loop": true,
  "tracks": [
    {
      "target": "bone",
      "name": "upper_leg_L",
      "property": "rotation_degrees",
      "keys": [
        {
          "time": 0,
          "value": -18
        },
        {
          "time": 0.4,
          "value": 22
        },
        {
          "time": 0.8,
          "value": -18
        }
      ]
    },
    {
      "target": "bone",
      "name": "upper_leg_R",
      "property": "rotation_degrees",
      "keys": [
        {
          "time": 0,
          "value": 22
        },
        {
          "time": 0.4,
          "value": -18
        },
        {
          "time": 0.8,
          "value": 22
        }
      ]
    },
    {
      "target": "bone",
      "name": "upper_arm_L",
      "property": "rotation_degrees",
      "keys": [
        {
          "time": 0,
          "value": 18
        },
        {
          "time": 0.4,
          "value": -18
        },
        {
          "time": 0.8,
          "value": 18
        }
      ]
    },
    {
      "target": "bone",
      "name": "upper_arm_R",
      "property": "rotation_degrees",
      "keys": [
        {
          "time": 0,
          "value": -18
        },
        {
          "time": 0.4,
          "value": 18
        },
        {
          "time": 0.8,
          "value": -18
        }
      ]
    }
  ],
  "events": []
}
